[
  {
    "id": "ask-interview",
    "name": "Ask Interview",
    "file": "skills/01-Discovery/ask-interview/SKILL.md",
    "category": "Clarification & Research",
    "pathAvailability": [
      "Short Path",
      "Regular Path",
      "Auto"
    ],
    "prerequisites": [
      "repository context readable",
      "route prerequisites satisfied"
    ],
    "sourceInspiration": [
      "Superpowers",
      "Matt Pocock skills",
      "ECC"
    ],
    "sharedSkill": true,
    "conflictsWith": [],
    "owner": "ECC-Fusion maintainers",
    "deprecated": false
  },
  {
    "id": "ecc-help",
    "name": "ECC Help",
    "file": "skills/01-Discovery/ecc-help/SKILL.md",
    "category": "Discovery & Help",
    "pathAvailability": [
      "Short Path",
      "Regular Path",
      "Auto"
    ],
    "prerequisites": [
      "repository context readable",
      "route prerequisites satisfied"
    ],
    "sourceInspiration": [
      "BMAD-METHOD",
      "ECC",
      "Agent OS"
    ],
    "sharedSkill": true,
    "conflictsWith": [],
    "owner": "ECC-Fusion maintainers",
    "deprecated": false
  },
  {
    "id": "grill-with-context",
    "name": "Grill With Context",
    "file": "skills/01-Discovery/grill-with-context/SKILL.md",
    "category": "Clarification & Research",
    "pathAvailability": [
      "Regular Path",
      "Auto"
    ],
    "prerequisites": [
      "repository context readable",
      "route prerequisites satisfied"
    ],
    "sourceInspiration": [
      "Superpowers",
      "Matt Pocock skills",
      "ECC"
    ],
    "sharedSkill": true,
    "conflictsWith": [],
    "owner": "ECC-Fusion maintainers",
    "deprecated": false
  },
  {
    "id": "write-spec",
    "name": "Write Spec",
    "file": "skills/01-Discovery/write-spec/SKILL.md",
    "category": "Specification & Product",
    "pathAvailability": [
      "Regular Path",
      "Auto"
    ],
    "prerequisites": [
      "repository context readable",
      "route prerequisites satisfied"
    ],
    "sourceInspiration": [
      "BMAD-METHOD",
      "ECC"
    ],
    "sharedSkill": true,
    "conflictsWith": [],
    "owner": "ECC-Fusion maintainers",
    "deprecated": false
  },
  {
    "id": "prototype-ui",
    "name": "Prototype UI",
    "file": "skills/02-Planning/prototype-ui/SKILL.md",
    "category": "Specification & Product",
    "pathAvailability": [
      "Regular Path",
      "Auto"
    ],
    "prerequisites": [
      "repository context readable",
      "route prerequisites satisfied"
    ],
    "sourceInspiration": [
      "Superpowers",
      "Matt Pocock skills",
      "ECC"
    ],
    "sharedSkill": true,
    "conflictsWith": [],
    "owner": "ECC-Fusion maintainers",
    "deprecated": false
  },
  {
    "id": "architecture-plan",
    "name": "Architecture Plan",
    "file": "skills/02-Planning/architecture-plan/SKILL.md",
    "category": "Architecture & Planning",
    "pathAvailability": [
      "Regular Path",
      "Auto"
    ],
    "prerequisites": [
      "repository context readable",
      "route prerequisites satisfied"
    ],
    "sourceInspiration": [
      "BMAD-METHOD",
      "ECC"
    ],
    "sharedSkill": true,
    "conflictsWith": [],
    "owner": "ECC-Fusion maintainers",
    "deprecated": false
  },
  {
    "id": "create-work-packets",
    "name": "Create Work Packets",
    "file": "skills/02-Planning/create-work-packets/SKILL.md",
    "category": "Work Packet & Delegation",
    "pathAvailability": [
      "Short Path",
      "Regular Path",
      "Auto"
    ],
    "prerequisites": [
      "repository context readable",
      "route prerequisites satisfied"
    ],
    "sourceInspiration": [
      "GSD Redux",
      "ECC"
    ],
    "sharedSkill": true,
    "conflictsWith": [],
    "owner": "ECC-Fusion maintainers",
    "deprecated": false
  },
  {
    "id": "implement-work-packet",
    "name": "Implement Work Packet",
    "file": "skills/03-Implementation/implement-work-packet/SKILL.md",
    "category": "Implementation",
    "pathAvailability": [
      "Short Path",
      "Regular Path"
    ],
    "prerequisites": [
      "repository context readable",
      "route prerequisites satisfied"
    ],
    "sourceInspiration": [
      "GSD Redux",
      "ECC"
    ],
    "sharedSkill": true,
    "conflictsWith": [],
    "owner": "ECC-Fusion maintainers",
    "deprecated": false
  },
  {
    "id": "tdd",
    "name": "TDD",
    "file": "skills/03-Implementation/tdd/SKILL.md",
    "category": "Testing & Verification",
    "pathAvailability": [
      "Short Path",
      "Regular Path"
    ],
    "prerequisites": [
      "repository context readable",
      "route prerequisites satisfied"
    ],
    "sourceInspiration": [
      "Superpowers",
      "Matt Pocock skills",
      "ECC"
    ],
    "sharedSkill": true,
    "conflictsWith": [],
    "owner": "ECC-Fusion maintainers",
    "deprecated": false
  },
  {
    "id": "diagnose",
    "name": "Diagnose",
    "file": "skills/04-Testing-and-QA/diagnose/SKILL.md",
    "category": "Clarification & Research",
    "pathAvailability": [
      "Short Path",
      "Regular Path",
      "Auto"
    ],
    "prerequisites": [
      "repository context readable",
      "route prerequisites satisfied"
    ],
    "sourceInspiration": [
      "Superpowers",
      "Matt Pocock skills",
      "ECC"
    ],
    "sharedSkill": true,
    "conflictsWith": [],
    "owner": "ECC-Fusion maintainers",
    "deprecated": false
  },
  {
    "id": "write-tests",
    "name": "Write Tests",
    "file": "skills/04-Testing-and-QA/write-tests/SKILL.md",
    "category": "Testing & Verification",
    "pathAvailability": [
      "Short Path",
      "Regular Path"
    ],
    "prerequisites": [
      "repository context readable",
      "route prerequisites satisfied"
    ],
    "sourceInspiration": [
      "Superpowers",
      "Matt Pocock skills",
      "ECC"
    ],
    "sharedSkill": true,
    "conflictsWith": [],
    "owner": "ECC-Fusion maintainers",
    "deprecated": false
  },
  {
    "id": "verify-work",
    "name": "Verify Work",
    "file": "skills/04-Testing-and-QA/verify-work/SKILL.md",
    "category": "Testing & Verification",
    "pathAvailability": [
      "Short Path",
      "Regular Path"
    ],
    "prerequisites": [
      "repository context readable",
      "route prerequisites satisfied"
    ],
    "sourceInspiration": [
      "Superpowers",
      "Matt Pocock skills",
      "ECC"
    ],
    "sharedSkill": true,
    "conflictsWith": [],
    "owner": "ECC-Fusion maintainers",
    "deprecated": false
  },
  {
    "id": "review-oss-output",
    "name": "Review OSS Output",
    "file": "skills/05-Review-and-Release/review-oss-output/SKILL.md",
    "category": "Review & Security",
    "pathAvailability": [
      "Short Path",
      "Regular Path"
    ],
    "prerequisites": [
      "repository context readable",
      "route prerequisites satisfied"
    ],
    "sourceInspiration": [
      "gstack",
      "ECC"
    ],
    "sharedSkill": true,
    "conflictsWith": [],
    "owner": "ECC-Fusion maintainers",
    "deprecated": false
  },
  {
    "id": "security-review",
    "name": "Security Review",
    "file": "skills/05-Review-and-Release/security-review/SKILL.md",
    "category": "Review & Security",
    "pathAvailability": [
      "Short Path",
      "Regular Path"
    ],
    "prerequisites": [
      "repository context readable",
      "route prerequisites satisfied"
    ],
    "sourceInspiration": [
      "gstack",
      "ECC"
    ],
    "sharedSkill": true,
    "conflictsWith": [],
    "owner": "ECC-Fusion maintainers",
    "deprecated": false
  },
  {
    "id": "qa-browser",
    "name": "QA Browser",
    "file": "skills/04-Testing-and-QA/qa-browser/SKILL.md",
    "category": "QA & Release",
    "pathAvailability": [
      "Regular Path"
    ],
    "prerequisites": [
      "repository context readable",
      "route prerequisites satisfied"
    ],
    "sourceInspiration": [
      "gstack",
      "ECC"
    ],
    "sharedSkill": false,
    "conflictsWith": [],
    "owner": "ECC-Fusion maintainers",
    "deprecated": false
  },
  {
    "id": "ship-release",
    "name": "Ship Release",
    "file": "skills/05-Review-and-Release/ship-release/SKILL.md",
    "category": "QA & Release",
    "pathAvailability": [
      "Regular Path"
    ],
    "prerequisites": [
      "repository context readable",
      "route prerequisites satisfied"
    ],
    "sourceInspiration": [
      "gstack",
      "ECC"
    ],
    "sharedSkill": false,
    "conflictsWith": [],
    "owner": "ECC-Fusion maintainers",
    "deprecated": false
  },
  {
    "id": "retro-learn",
    "name": "Retro Learn",
    "file": "skills/05-Review-and-Release/retro-learn/SKILL.md",
    "category": "Documentation & Handoff",
    "pathAvailability": [
      "Regular Path"
    ],
    "prerequisites": [
      "repository context readable",
      "route prerequisites satisfied"
    ],
    "sourceInspiration": [
      "gstack",
      "ECC"
    ],
    "sharedSkill": false,
    "conflictsWith": [],
    "owner": "ECC-Fusion maintainers",
    "deprecated": false
  },
  {
    "id": "write-a-skill",
    "name": "Write A Skill",
    "file": "skills/06-Governance/write-a-skill/SKILL.md",
    "category": "Governance & Maintenance",
    "pathAvailability": [
      "Regular Path"
    ],
    "prerequisites": [
      "repository context readable",
      "route prerequisites satisfied"
    ],
    "sourceInspiration": [
      "Superpowers",
      "Matt Pocock skills",
      "ECC"
    ],
    "sharedSkill": false,
    "conflictsWith": [],
    "owner": "ECC-Fusion maintainers",
    "deprecated": false
  },
  {
    "id": "skill-lint",
    "name": "Skill Lint",
    "file": "skills/06-Governance/skill-lint/SKILL.md",
    "category": "Governance & Maintenance",
    "pathAvailability": [
      "Short Path",
      "Regular Path"
    ],
    "prerequisites": [
      "repository context readable",
      "route prerequisites satisfied"
    ],
    "sourceInspiration": [
      "OpenSpec",